{
  "name": "building_owner",
  "primaryKey": [
    "id"
  ],
  "foreignKeys": [
    {
      "name": "building_owner_building_id_fkey",
      "columns": [
        "building_id",
        "building_version"
      ],
      "target": {
        "schema": "sample",
        "name": "building_h",
        "columns": [
          "id",
          "version"
        ]
      }
    },
    {
      "name": "building_owner_owner_id_fkey",
      "columns": [
        "owner_id"
      ],
      "target": {
        "schema": "sample",
        "name": "user",
        "columns": [
          "id"
        ]
      }
    }
  ],
  "columns": [
    {
      "name": "id",
      "type": "integer",
      "required": true
    },
    {
      "name": "building_id",
      "type": "uuid",
      "required": false
    },
    {
      "name": "building_version",
      "type": "integer",
      "required": false
    },
    {
      "name": "owner_id",
      "type": "integer",
      "required": false
    }
  ]
}